{
  "version": 2,
  "source": {
    "type": "pdf",
    "uri": "https://example.org/finite-groups.pdf",
    "extensions": {
      "org.example.catalog": {
        "title": "Finite groups: synthetic notes",
        "edition": "example-only"
      }
    }
  },
  "id": "lagrange-supporting-definition",
  "location": {
    "page": 7,
    "rect": [
      0.12,
      0.25,
      0.76,
      0.18
    ]
  },
  "target": "https://example.org/formal/Groups.html#subgroupIndex",
  "extensions": {
    "org.example.curation": {
      "group": "lagrange-passage",
      "relation": "supporting-definition",
      "reviewed": false
    }
  }
}
