{
  "version": 2,
  "source": {
    "type": "pdf",
    "uri": "https://example.org/finite-groups.pdf",
    "extensions": {
      "org.example.catalog": {
        "title": "Finite groups: synthetic notes",
        "edition": "example-only"
      }
    }
  },
  "id": "lagrange-theorem",
  "location": {
    "page": 7,
    "rect": [
      0.12,
      0.25,
      0.76,
      0.18
    ]
  },
  "target": "https://example.org/formal/Groups.html#lagrange",
  "extensions": {
    "org.example.viewer": {
      "label": "Lagrange's theorem",
      "description": "The order of a subgroup divides the order of a finite group."
    },
    "org.example.curation": {
      "group": "lagrange-passage",
      "relation": "candidate-correspondence",
      "reviewed": false
    }
  }
}
